{
  "schema_version": 1,
  "request_id": "rf-ghost-request-chain-feed-heater-flash-alternate-candidate-tab-after-other-skip-001",
  "project": "radishflow",
  "task": "suggest_ghost_completion",
  "locale": "zh-CN",
  "artifacts": [
    {
      "kind": "json",
      "role": "primary",
      "name": "flowsheet_document",
      "mime_type": "application/json",
      "uri": "artifact://flowsheet/current"
    }
  ],
  "context": {
    "document_revision": 60,
    "selected_unit_ids": [
      "heater-6"
    ],
    "selected_unit": {
      "id": "heater-6",
      "kind": "Heater",
      "name": "Feed Heater 605"
    },
    "legal_candidate_completions": [
      {
        "candidate_ref": "cand-heater-6-outlet-flash-26",
        "ghost_kind": "ghost_connection",
        "target_port_key": "outlet",
        "target_unit_id": "heater-6",
        "target_node_id": "flash-26.inlet",
        "suggested_stream_name": "H-605",
        "is_high_confidence": true,
        "is_tab_default": true
      }
    ],
    "unconnected_ports": [
      "outlet"
    ],
    "cursor_context": {
      "mode": "unit_selected",
      "recent_actions": [
        {
          "kind": "accept_ghost_completion",
          "candidate_ref": "cand-feed-605-to-heater-6-inlet",
          "accepted_at_revision": 58
        },
        {
          "kind": "skip_ghost_completion",
          "candidate_ref": "cand-heater-6-outlet-flash-25",
          "skipped_at_revision": 59
        }
      ]
    },
    "naming_hints": {
      "upstream_stream_names": [
        "F-605"
      ],
      "existing_stream_names": [
        "F-605"
      ],
      "preferred_outlet_prefix": "H",
      "numeric_suffix_from_unit": "605"
    },
    "topology_pattern_hints": [
      "feed_heater_flash_chain",
      "heater_outlet_to_flash_inlet_after_feed_connection",
      "recent_skip_only_suppresses_same_candidate"
    ],
    "nearby_nodes": [
      {
        "type": "unit_port",
        "id": "flash-26.inlet",
        "direction": "downstream"
      },
      {
        "type": "unit_port",
        "id": "flash-25.inlet",
        "direction": "downstream"
      }
    ]
  },
  "tool_hints": {
    "allow_retrieval": false,
    "allow_tool_calls": false,
    "allow_image_reasoning": false
  },
  "safety": {
    "mode": "advisory",
    "requires_confirmation_for_actions": false
  }
}
