{
  "schema_version": 1,
  "request_id": "rf-ghost-request-chain-feed-heater-flash-outlet-dismiss-no-retab-001-debug-full",
  "project": "radishflow",
  "task": "suggest_ghost_completion",
  "locale": "zh-CN",
  "artifacts": [
    {
      "kind": "json",
      "role": "primary",
      "name": "flowsheet_document",
      "mime_type": "application/json",
      "uri": "artifact://flowsheet/current"
    }
  ],
  "context": {
    "document_revision": 55,
    "selected_unit_ids": [
      "heater-3"
    ],
    "selected_unit": {
      "id": "heater-3",
      "kind": "Heater",
      "name": "Feed Heater 602"
    },
    "legal_candidate_completions": [
      {
        "candidate_ref": "cand-heater-3-outlet-flash-15",
        "ghost_kind": "ghost_connection",
        "target_port_key": "outlet",
        "target_unit_id": "heater-3",
        "target_node_id": "flash-15.inlet",
        "suggested_stream_name": "H-602",
        "ranking_signals": {
          "distance_px": 65,
          "alignment_score": 0.94,
          "topology_score": 0.91,
          "score_gap_to_next": 0.0,
          "template_frequency": 0.83
        },
        "naming_signals": {
          "derived_from_upstream_name": true,
          "applied_prefix": "H",
          "numeric_suffix": "602",
          "reused_existing_pattern": true,
          "collision_checked": true
        },
        "conflict_flags": [
          "recent_dismiss_cooldown_active",
          "manual_reselection_required"
        ],
        "is_high_confidence": false,
        "is_tab_default": false
      }
    ],
    "unconnected_ports": [
      "outlet"
    ],
    "cursor_context": {
      "mode": "unit_selected",
      "recent_actions": [
        {
          "kind": "accept_ghost_completion",
          "candidate_ref": "cand-feed-602-to-heater-3-inlet",
          "accepted_at_revision": 53
        },
        {
          "kind": "dismiss_ghost_completion",
          "candidate_ref": "cand-heater-3-outlet-flash-15",
          "dismissed_at_revision": 54
        }
      ]
    },
    "naming_hints": {
      "upstream_stream_names": [
        "F-602"
      ],
      "existing_stream_names": [
        "F-602"
      ],
      "preferred_outlet_prefix": "H",
      "numeric_suffix_from_unit": "602"
    },
    "topology_pattern_hints": [
      "feed_heater_flash_chain",
      "heater_outlet_to_flash_inlet_after_feed_connection",
      "recent_dismiss_same_candidate_requires_manual_reselect"
    ],
    "nearby_nodes": [
      {
        "type": "unit_port",
        "id": "flash-15.inlet",
        "direction": "downstream",
        "distance_px": 65,
        "alignment_score": 0.94
      }
    ]
  },
  "tool_hints": {
    "allow_retrieval": false,
    "allow_tool_calls": false,
    "allow_image_reasoning": false
  },
  "safety": {
    "mode": "advisory",
    "requires_confirmation_for_actions": false
  }
}
