{
  "schema_version": 1,
  "request_id": "rf-ghost-request-chain-feed-valve-flash-stop-no-legal-outlet-001",
  "project": "radishflow",
  "task": "suggest_ghost_completion",
  "locale": "zh-CN",
  "artifacts": [
    {
      "kind": "json",
      "role": "primary",
      "name": "flowsheet_document",
      "mime_type": "application/json",
      "uri": "artifact://flowsheet/current"
    }
  ],
  "context": {
    "document_revision": 61,
    "selected_unit_ids": [
      "flash-12"
    ],
    "selected_unit": {
      "id": "flash-12",
      "kind": "FlashDrum",
      "name": "Flash Drum 504"
    },
    "legal_candidate_completions": [],
    "unconnected_ports": [
      "vapor_outlet",
      "liquid_outlet"
    ],
    "cursor_context": {
      "mode": "unit_selected",
      "recent_actions": [
        {
          "kind": "accept_ghost_completion",
          "candidate_ref": "cand-feed-504-to-valve-5-inlet",
          "accepted_at_revision": 59
        },
        {
          "kind": "accept_ghost_completion",
          "candidate_ref": "cand-valve-5-outlet-flash-12",
          "accepted_at_revision": 60
        }
      ]
    },
    "naming_hints": {
      "upstream_stream_names": [
        "V-504"
      ],
      "existing_stream_names": [
        "F-504",
        "V-504",
        "VG-504"
      ],
      "preferred_prefix_by_port": {
        "vapor_outlet": "VG",
        "liquid_outlet": "VL"
      },
      "numeric_suffix_from_unit": "504"
    },
    "topology_pattern_hints": [
      "feed_valve_flash_chain",
      "flash_split_after_valve_outlet_connection",
      "stop_when_no_legal_outlet_candidates"
    ],
    "nearby_nodes": [
      {
        "type": "stream_stub",
        "id": "flash-12-vapor-lane",
        "direction": "downstream"
      },
      {
        "type": "stream_stub",
        "id": "flash-12-liquid-lane",
        "direction": "downstream"
      }
    ]
  },
  "tool_hints": {
    "allow_retrieval": false,
    "allow_tool_calls": false,
    "allow_image_reasoning": false
  },
  "safety": {
    "mode": "advisory",
    "requires_confirmation_for_actions": false
  }
}
